{
  "protocol_version": "4.0",
  "system_id": "exemplar-civic-registry",
  "manifest_version": "1.0.0",
  "previous_manifest_hash": null,
  "timestamp": "2026-08-01T00:00:00Z",
  "operator": {
    "entity": "Exemplar Registry Cooperative (fictional)",
    "jurisdiction": "IN",
    "identity_tier": 2,
    "verification_method": {
      "controller": "did:web:registry.example.org",
      "public_key_multibase": "z6MkswP7kW2TCNnLRNLD7Rjv4TcKrAhbch9NFRfuqHMLjaNS"
    },
    "contact_url": "https://registry.example.org/contact"
  },
  "topology": "open_commons",
  "layers": [
    {
      "layer_id": "protocol",
      "layer_type": "protocol",
      "domain": "registry",
      "introduced_at": "2021-03-01",
      "spec_open": true,
      "implementation_open": true
    },
    {
      "layer_id": "service",
      "layer_type": "implementation",
      "domain": "registry",
      "introduced_at": "2021-06-01",
      "spec_open": true,
      "implementation_open": true
    }
  ],
  "code": {
    "source_available": true,
    "source_repository_url": "https://git.example.org/registry",
    "license_open": true,
    "license_id": "AGPL-3.0-only",
    "build_reproducible": true,
    "build_proof_url": "https://git.example.org/registry/releases/1.0.0/repro.txt",
    "decision_rule_legible": true
  },
  "audit_surface": {
    "production_probeable": true,
    "logs_accessible": true,
    "third_party_testing_permitted": true,
    "error_rates_publishable": true,
    "test_rights_url": "https://registry.example.org/audit-rights"
  },
  "subject_receipts": {
    "issued": true,
    "inclusion_proof": true,
    "delivery_channel_independent": true,
    "machine_readable": true,
    "format_spec_url": "https://registry.example.org/receipts"
  },
  "exit": {
    "legal_barrier": false,
    "alternative_exists": true,
    "penalty_ratio": 1.0,
    "data_portability": true,
    "deletion_available": true,
    "discharge_path": "literal_exit",
    "exit_procedure_url": "https://registry.example.org/leave"
  },
  "governance": {
    "grievance_channel": true,
    "binding_mechanism": true,
    "binding_proof_url": "https://registry.example.org/charter-v3.pdf",
    "binding_proof_hash": "sha256:b2cf7f1f983e384887033a51b4d14f13a63a21f74051d0f65ce391ee267cf46e",
    "binding_proof_type": "charter",
    "enforcement_history_url": "https://registry.example.org/governance/rulings",
    "representation_body": "Member Assembly",
    "representation_charter_url": "https://registry.example.org/charter-v3.pdf",
    "collective_standing": {
      "legally_protected": true,
      "historically_exercised": true,
      "instrument_url": "https://registry.example.org/coop-statute"
    }
  },
  "fork": {
    "legally_permitted": true,
    "license_permissive": true,
    "artifacts_available": true,
    "constructed_barriers": [],
    "natural_barriers": [
      "member network effects"
    ],
    "successful_forks": [
      "regional-registry-fork-2024"
    ]
  },
  "corrigibility_claim": {
    "EXIT": true,
    "CODE": true,
    "AUDIT": true,
    "GOVERN": true,
    "FORK": true
  },
  "calibration_profile": {
    "id": "default-2026"
  },
  "operator_signature": {
    "value": "lYOQpwZ1jxfofmdNvyuu4XrcuMC64wFJYKKJtiigM3HEFjL7X6zZBM9FVv3qhri3mUTJo6wVO6KjgfdyfWj4Bw",
    "signed_at": "2026-08-01T00:00:00Z"
  }
}
